{
  "$schema": "http://json-schema.org/draft-07/schema#",
  "title": "X-Travel: Global Mobility Matrix",
  "subtitle": "Optimizing the Human Experience Vector. First Principles.",
  "layers": [
    { "title": "PHYSICS INGESTION", "x": 125, "dividerX": 250 },
    { "title": "THE CORE", "x": 360, "dividerX": 475 },
    { "title": "SIMULATION & OPTIMIZATION", "x": 650, "dividerX": 900 },
    { "title": "ACTUATION & EXECUTION", "x": 1000, "dividerX": 1175 },
    { "title": "NEURAL INTERFACE", "x": 1300, "dividerX": null }
  ],
  "components": {
    "globalSensorArray": {
      "name": "Global Sensor Array", "description": "Real-time data firehose.", "details": "Ingests raw, unstructured data streams from everything: market fluctuations, weather patterns, social vectors, traffic physics. The system's senses.",
      "x": 50, "y": 375, "width": 150, "height": 100, "fill": "#424242"
    },
    "dataRefinery": {
      "name": "Data Refinery", "description": "Signal from noise.", "details": "A massive ETL pipeline that cleans, structures, and vectorizes raw data into usable information for The Core. The boring but critical part.",
      "x": 290, "y": 200, "width": 150, "height": 100, "fill": "#303030"
    },
    "itineraryPrime": {
      "name": "Itinerary Prime", "description": "The Generalist AI.", "details": "The central intelligence. A singular, powerful transformer model that processes all refined data to understand the state of the world and the user's utility function.",
      "x": 290, "y": 375, "width": 150, "height": 150, "fill": "#ff3d00"
    },
    "userVectorDB": {
      "name": "User Utility Function DB", "description": "The user's soul, in math.", "details": "Stores the mathematical representation of each user's preferences, constraints, and predicted desires. This is what Prime optimizes for.",
      "x": 290, "y": 575, "width": 150, "height": 100, "fill": "#303030"
    },
    "futureSimEngine": {
      "name": "Future Simulation Engine", "description": "The factory floor.", "details": "Generates millions of potential trip-futures based on a user's goal, then runs them through a physics-based simulation to predict outcomes and resource cost.",
      "x": 525, "y": 375, "width": 160, "height": 125, "fill": "#bf360c"
    },
    "optimizer": {
      "name": "Optimizer", "description": "Finds the one true path.", "details": "Scores every simulated future against the user's utility function and global constraints. It discards all but the single, mathematically optimal itinerary.",
      "x": 715, "y": 375, "width": 160, "height": 125, "fill": "#bf360c"
    },
    "actuatorFleet": {
      "name": "Actuator Fleet", "description": "Makes things happen.", "details": "A swarm of autonomous software agents that execute the chosen itinerary. They book flights, cars, tables, and interface with legacy systems via the Bridge.",
      "x": 960, "y": 375, "width": 170, "height": 100, "fill": "#757575"
    },
    "legacyBridge": {
      "name": "Legacy System Bridge", "description": "Connects to the old world.", "details": "API gateway to all external, third-party systems. To be phased out over time through vertical integration.",
      "x": 960, "y": 575, "width": 170, "height": 75, "fill": "#616161"
    },
    "neuralInterface": {
      "name": "Neural Interface", "description": "The App.", "details": "The minimalist, high-bandwidth interface for the user to state goals and receive the single, optimized plan. For now, it's an app. Eventually, it won't be.",
      "x": 1220, "y": 375, "width": 180, "height": 75, "fill": "#212121"
    }
  },
  "flows": [
    { "id": 1, "description": "1. Raw Physics", "path": "M 200 425 L 290 250", "label_cx": 245, "label_cy": 330 },
    { "id": 2, "description": "2. Refined Signal", "path": "M 290 300 L 290 375", "label_cx": 270, "label_cy": 340 },
    { "id": 3, "description": "3. User Vector", "path": "M 365 575 L 365 525", "label_cx": 385, "label_cy": 550 },
    { "id": 4, "description": "4. Goal", "path": "M 1220 412.5 C 800 412.5, 475 412.5, 440 412.5", "label_cx": 830, "label_cy": 400 },
    { "id": 5, "description": "5. Generate Futures", "path": "M 440 412.5 L 525 412.5", "label_cx": 480, "label_cy": 400 },
    { "id": 6, "description": "6. Optimize", "path": "M 685 437.5 L 715 437.5", "label_cx": 700, "label_cy": 450 },
    { "id": 7, "description": "7. Optimal Path", "path": "M 875 425 L 960 425", "label_cx": 915, "label_cy": 415 },
    { "id": 8, "description": "8. Execute", "path": "M 1130 412.5 L 1220 412.5", "label_cx": 1175, "label_cy": 425, "options": { "stroke-dasharray": "10, 2" } },
    { "id": 9, "description": "9. Actuate via Legacy", "path": "M 1045 475 L 1045 575", "label_cx": 1065, "label_cy": 525 },
    { "id": 10, "description": "10. Present Final Plan", "path": "M 960 412.5 C 900 412.5, 1150 412.5, 1220 412.5", "label_cx": 1080, "label_cy": 430 },
    { "id": 11, "description": "11. Feedback Loop (Reality)", "path": "M 1220 450 C 600 600, 200 600, 125 475", "label_cx": 675, "label_cy": 620, "options": { "stroke-dasharray": "2, 3" } }
  ]
}
